{
  "id": "calling",
  "name": "Calling",
  "componentBaseName": "Calling",
  "category": "communication",
  "tags": [
    "call",
    "calling"
  ],
  "aliases": [],
  "description": "Calling icon - Communication",
  "variants": {
    "outline": {
      "available": true,
      "componentName": "Calling01",
      "svgPath": "icons/communication/calling-01.svg",
      "componentPath": "./components/icons/Outline/Calling01",
      "supportsStrokeWidth": false,
      "defaultStrokeWidth": 0,
      "fillType": "fill"
    },
    "bulk": {
      "available": true,
      "componentName": "Calling03",
      "svgPath": "icons/communication/calling-03.svg",
      "componentPath": "./components/icons/Bulk/Calling03",
      "supportsStrokeWidth": false,
      "defaultStrokeWidth": 0,
      "fillType": "fill"
    },
    "light": {
      "available": true,
      "componentName": "Calling04",
      "svgPath": "icons/communication/calling-04.svg",
      "componentPath": "./components/icons/Light/Calling04",
      "supportsStrokeWidth": true,
      "defaultStrokeWidth": 1,
      "fillType": "stroke"
    },
    "two-tone": {
      "available": true,
      "componentName": "Calling05",
      "svgPath": "icons/communication/calling-05.svg",
      "componentPath": "./components/icons/TwoTone/Calling05",
      "supportsStrokeWidth": true,
      "defaultStrokeWidth": 1.5,
      "fillType": "mixed"
    }
  },
  "metadata": {
    "addedDate": "2025-10-31",
    "lastModified": "2025-10-31",
    "version": "0.0.2",
    "author": "Jaya Raj Srivathsav Adari",
    "popularity": 0,
    "isDeprecated": false
  },
  "usage": {
    "recommended": [],
    "codeExample": "import { CallingTwoTone } from 'magic-icons';\n\n<CallingTwoTone size={24} color=\"currentColor\" />"
  },
  "accessibility": {
    "ariaLabel": "calling",
    "title": "Calling"
  }
}