{
  "id": "menu-duo",
  "name": "MenuDuo",
  "componentBaseName": "MenuDuo",
  "category": "action",
  "tags": [
    "menu",
    "duo"
  ],
  "aliases": [],
  "description": "MenuDuo icon - Actions & Operations",
  "variants": {
    "light": {
      "available": true,
      "componentName": "MenuDuo04",
      "svgPath": "icons/action/menu-duo-04.svg",
      "componentPath": "./components/icons/Light/MenuDuo04",
      "supportsStrokeWidth": true,
      "defaultStrokeWidth": 1,
      "fillType": "stroke"
    }
  },
  "metadata": {
    "addedDate": "2025-11-01",
    "lastModified": "2025-11-01",
    "version": "0.0.2",
    "author": "Jaya Raj Srivathsav Adari",
    "popularity": 0,
    "isDeprecated": false
  },
  "usage": {
    "recommended": [],
    "codeExample": "import { MenuDuoTwoTone } from 'magic-icons';\n\n<MenuDuoTwoTone size={24} color=\"currentColor\" />"
  },
  "accessibility": {
    "ariaLabel": "menu duo",
    "title": "MenuDuo"
  }
}