{
  "id": "arrow-left-two",
  "name": "ArrowLeftTwo",
  "componentBaseName": "ArrowLeftTwo",
  "category": "navigation",
  "tags": [
    "arrow",
    "left",
    "two"
  ],
  "aliases": [],
  "description": "ArrowLeftTwo icon - Navigation & Arrows",
  "variants": {
    "outline": {
      "available": true,
      "componentName": "ArrowLeftTwo01",
      "svgPath": "icons/navigation/arrow-left-two-01.svg",
      "componentPath": "./components/icons/Outline/ArrowLeftTwo01",
      "supportsStrokeWidth": false,
      "defaultStrokeWidth": 0,
      "fillType": "fill"
    },
    "broken": {
      "available": true,
      "componentName": "ArrowLeftTwo02",
      "svgPath": "icons/navigation/arrow-left-two-02.svg",
      "componentPath": "./components/icons/Broken/ArrowLeftTwo02",
      "supportsStrokeWidth": false,
      "defaultStrokeWidth": 0,
      "fillType": "fill"
    },
    "bulk": {
      "available": true,
      "componentName": "ArrowLeftTwo03",
      "svgPath": "icons/navigation/arrow-left-two-03.svg",
      "componentPath": "./components/icons/Bulk/ArrowLeftTwo03",
      "supportsStrokeWidth": false,
      "defaultStrokeWidth": 0,
      "fillType": "fill"
    },
    "light": {
      "available": true,
      "componentName": "ArrowLeftTwo04",
      "svgPath": "icons/navigation/arrow-left-two-04.svg",
      "componentPath": "./components/icons/Light/ArrowLeftTwo04",
      "supportsStrokeWidth": true,
      "defaultStrokeWidth": 1,
      "fillType": "stroke"
    },
    "two-tone": {
      "available": true,
      "componentName": "ArrowLeftTwo05",
      "svgPath": "icons/navigation/arrow-left-two-05.svg",
      "componentPath": "./components/icons/TwoTone/ArrowLeftTwo05",
      "supportsStrokeWidth": true,
      "defaultStrokeWidth": 1.5,
      "fillType": "mixed"
    }
  },
  "metadata": {
    "addedDate": "2025-10-31",
    "lastModified": "2025-10-31",
    "version": "0.0.2",
    "author": "Jaya Raj Srivathsav Adari",
    "popularity": 0,
    "isDeprecated": false
  },
  "usage": {
    "recommended": [],
    "codeExample": "import { ArrowLeftTwoTwoTone } from 'magic-icons';\n\n<ArrowLeftTwoTwoTone size={24} color=\"currentColor\" />"
  },
  "accessibility": {
    "ariaLabel": "arrow left two",
    "title": "ArrowLeftTwo"
  }
}