{
  "id": "more-grid",
  "name": "MoreGrid",
  "componentBaseName": "MoreGrid",
  "category": "action",
  "tags": [
    "more",
    "grid"
  ],
  "aliases": [],
  "description": "MoreGrid icon - Actions & Operations",
  "variants": {
    "outline": {
      "available": true,
      "componentName": "MoreGrid01",
      "svgPath": "icons/action/more-grid-01.svg",
      "componentPath": "./components/icons/Outline/MoreGrid01",
      "supportsStrokeWidth": false,
      "defaultStrokeWidth": 0,
      "fillType": "fill"
    },
    "light": {
      "available": true,
      "componentName": "MoreGrid04",
      "svgPath": "icons/action/more-grid-04.svg",
      "componentPath": "./components/icons/Light/MoreGrid04",
      "supportsStrokeWidth": true,
      "defaultStrokeWidth": 1,
      "fillType": "stroke"
    }
  },
  "metadata": {
    "addedDate": "2025-11-01",
    "lastModified": "2025-11-01",
    "version": "0.0.2",
    "author": "Jaya Raj Srivathsav Adari",
    "popularity": 0,
    "isDeprecated": false
  },
  "usage": {
    "recommended": [],
    "codeExample": "import { MoreGridTwoTone } from 'magic-icons';\n\n<MoreGridTwoTone size={24} color=\"currentColor\" />"
  },
  "accessibility": {
    "ariaLabel": "more grid",
    "title": "MoreGrid"
  }
}