{
  "id": "arrow-right",
  "name": "ArrowRight",
  "componentBaseName": "ArrowRight",
  "category": "navigation",
  "tags": [
    "arrow",
    "right"
  ],
  "aliases": [],
  "description": "ArrowRight icon - Navigation & Arrows",
  "variants": {
    "broken": {
      "available": true,
      "componentName": "ArrowRightBroken",
      "svgPath": "icons/navigation/arrow-right-broken.svg",
      "componentPath": "./components/icons/Broken/ArrowRightBroken",
      "supportsStrokeWidth": false,
      "defaultStrokeWidth": 0,
      "fillType": "fill"
    },
    "bulk": {
      "available": true,
      "componentName": "ArrowRightBulk",
      "svgPath": "icons/navigation/arrow-right-bulk.svg",
      "componentPath": "./components/icons/Bulk/ArrowRightBulk",
      "supportsStrokeWidth": false,
      "defaultStrokeWidth": 0,
      "fillType": "fill"
    },
    "light": {
      "available": true,
      "componentName": "ArrowRightLight",
      "svgPath": "icons/navigation/arrow-right-light.svg",
      "componentPath": "./components/icons/Light/ArrowRightLight",
      "supportsStrokeWidth": true,
      "defaultStrokeWidth": 1,
      "fillType": "stroke"
    },
    "outline": {
      "available": true,
      "componentName": "ArrowRightOutline",
      "svgPath": "icons/navigation/arrow-right-outline.svg",
      "componentPath": "./components/icons/Outline/ArrowRightOutline",
      "supportsStrokeWidth": false,
      "defaultStrokeWidth": 0,
      "fillType": "fill"
    },
    "two-tone": {
      "available": true,
      "componentName": "ArrowRightTwoTone",
      "svgPath": "icons/navigation/arrow-right-two-tone.svg",
      "componentPath": "./components/icons/TwoTone/ArrowRightTwoTone",
      "supportsStrokeWidth": true,
      "defaultStrokeWidth": 1.5,
      "fillType": "mixed"
    }
  },
  "metadata": {
    "addedDate": "2025-10-31",
    "lastModified": "2025-10-31",
    "version": "0.0.2",
    "author": "Jaya Raj Srivathsav Adari",
    "popularity": 0,
    "isDeprecated": false
  },
  "usage": {
    "recommended": [],
    "codeExample": "import { ArrowRightTwoTone } from 'magic-icons';\n\n<ArrowRightTwoTone size={24} color=\"currentColor\" />"
  },
  "accessibility": {
    "ariaLabel": "arrow right",
    "title": "ArrowRight"
  }
}