{
  "id": "arrow-sub-up-left",
  "name": "ArrowSubUpLeft",
  "componentBaseName": "ArrowSubUpLeft",
  "category": "action",
  "tags": [
    "arrow",
    "sub",
    "up",
    "left"
  ],
  "aliases": [],
  "description": "ArrowSubUpLeft icon - Actions & Operations",
  "variants": {
    "outline": {
      "available": true,
      "componentName": "ArrowSubUpLeft01",
      "svgPath": "icons/action/arrow-sub-up-left-01.svg",
      "componentPath": "./components/icons/Outline/ArrowSubUpLeft01",
      "supportsStrokeWidth": false,
      "defaultStrokeWidth": 0,
      "fillType": "fill"
    },
    "light": {
      "available": true,
      "componentName": "ArrowSubUpLeft04",
      "svgPath": "icons/action/arrow-sub-up-left-04.svg",
      "componentPath": "./components/icons/Light/ArrowSubUpLeft04",
      "supportsStrokeWidth": true,
      "defaultStrokeWidth": 1,
      "fillType": "stroke"
    }
  },
  "metadata": {
    "addedDate": "2025-11-01",
    "lastModified": "2025-11-01",
    "version": "0.0.2",
    "author": "Jaya Raj Srivathsav Adari",
    "popularity": 0,
    "isDeprecated": false
  },
  "usage": {
    "recommended": [],
    "codeExample": "import { ArrowSubUpLeftTwoTone } from 'magic-icons';\n\n<ArrowSubUpLeftTwoTone size={24} color=\"currentColor\" />"
  },
  "accessibility": {
    "ariaLabel": "arrow sub up left",
    "title": "ArrowSubUpLeft"
  }
}