{
  "id": "arrow-down-two",
  "name": "ArrowDownTwo",
  "componentBaseName": "ArrowDownTwo",
  "category": "navigation",
  "tags": [
    "arrow",
    "down",
    "two"
  ],
  "aliases": [],
  "description": "ArrowDownTwo icon - Navigation & Arrows",
  "variants": {
    "broken": {
      "available": true,
      "componentName": "ArrowDownTwoBroken",
      "svgPath": "icons/navigation/arrow-down-two-broken.svg",
      "componentPath": "./components/icons/Broken/ArrowDownTwoBroken",
      "supportsStrokeWidth": false,
      "defaultStrokeWidth": 0,
      "fillType": "fill"
    },
    "bulk": {
      "available": true,
      "componentName": "ArrowDownTwoBulk",
      "svgPath": "icons/navigation/arrow-down-two-bulk.svg",
      "componentPath": "./components/icons/Bulk/ArrowDownTwoBulk",
      "supportsStrokeWidth": false,
      "defaultStrokeWidth": 0,
      "fillType": "fill"
    },
    "light": {
      "available": true,
      "componentName": "ArrowDownTwoLight",
      "svgPath": "icons/navigation/arrow-down-two-light.svg",
      "componentPath": "./components/icons/Light/ArrowDownTwoLight",
      "supportsStrokeWidth": true,
      "defaultStrokeWidth": 1,
      "fillType": "stroke"
    },
    "outline": {
      "available": true,
      "componentName": "ArrowDownTwoOutline",
      "svgPath": "icons/navigation/arrow-down-two-outline.svg",
      "componentPath": "./components/icons/Outline/ArrowDownTwoOutline",
      "supportsStrokeWidth": false,
      "defaultStrokeWidth": 0,
      "fillType": "fill"
    },
    "two-tone": {
      "available": true,
      "componentName": "ArrowDownTwoTwoTone",
      "svgPath": "icons/navigation/arrow-down-two-two-tone.svg",
      "componentPath": "./components/icons/TwoTone/ArrowDownTwoTwoTone",
      "supportsStrokeWidth": true,
      "defaultStrokeWidth": 1.5,
      "fillType": "mixed"
    }
  },
  "metadata": {
    "addedDate": "2025-10-31",
    "lastModified": "2025-10-31",
    "version": "0.0.2",
    "author": "Jaya Raj Srivathsav Adari",
    "popularity": 0,
    "isDeprecated": false
  },
  "usage": {
    "recommended": [],
    "codeExample": "import { ArrowDownTwoTwoTone } from 'magic-icons';\n\n<ArrowDownTwoTwoTone size={24} color=\"currentColor\" />"
  },
  "accessibility": {
    "ariaLabel": "arrow down two",
    "title": "ArrowDownTwo"
  }
}