{
  "id": "show",
  "name": "Show",
  "componentBaseName": "Show",
  "category": "ui",
  "tags": [
    "show"
  ],
  "aliases": [],
  "description": "Show icon - UI Elements",
  "variants": {
    "outline": {
      "available": true,
      "componentName": "Show01",
      "svgPath": "icons/ui/show-01.svg",
      "componentPath": "./components/icons/Outline/Show01",
      "supportsStrokeWidth": false,
      "defaultStrokeWidth": 0,
      "fillType": "fill"
    },
    "broken": {
      "available": true,
      "componentName": "Show02",
      "svgPath": "icons/ui/show-02.svg",
      "componentPath": "./components/icons/Broken/Show02",
      "supportsStrokeWidth": false,
      "defaultStrokeWidth": 0,
      "fillType": "fill"
    },
    "bulk": {
      "available": true,
      "componentName": "Show03",
      "svgPath": "icons/ui/show-03.svg",
      "componentPath": "./components/icons/Bulk/Show03",
      "supportsStrokeWidth": false,
      "defaultStrokeWidth": 0,
      "fillType": "fill"
    },
    "light": {
      "available": true,
      "componentName": "Show04",
      "svgPath": "icons/ui/show-04.svg",
      "componentPath": "./components/icons/Light/Show04",
      "supportsStrokeWidth": true,
      "defaultStrokeWidth": 1,
      "fillType": "stroke"
    },
    "two-tone": {
      "available": true,
      "componentName": "Show05",
      "svgPath": "icons/ui/show-05.svg",
      "componentPath": "./components/icons/TwoTone/Show05",
      "supportsStrokeWidth": true,
      "defaultStrokeWidth": 1.5,
      "fillType": "mixed"
    }
  },
  "metadata": {
    "addedDate": "2025-10-31",
    "lastModified": "2025-10-31",
    "version": "0.0.2",
    "author": "Jaya Raj Srivathsav Adari",
    "popularity": 0,
    "isDeprecated": false
  },
  "usage": {
    "recommended": [],
    "codeExample": "import { ShowTwoTone } from 'magic-icons';\n\n<ShowTwoTone size={24} color=\"currentColor\" />"
  },
  "accessibility": {
    "ariaLabel": "show",
    "title": "Show"
  }
}