{
  "id": "slider01",
  "name": "Slider01",
  "componentBaseName": "Slider01",
  "category": "action",
  "tags": [
    "slider01"
  ],
  "aliases": [],
  "description": "Slider01 icon - Actions & Operations",
  "variants": {
    "outline": {
      "available": true,
      "componentName": "Slider0101",
      "svgPath": "icons/action/slider-01-01.svg",
      "componentPath": "./components/icons/Outline/Slider0101",
      "supportsStrokeWidth": false,
      "defaultStrokeWidth": 0,
      "fillType": "fill"
    }
  },
  "metadata": {
    "addedDate": "2025-10-31",
    "lastModified": "2025-10-31",
    "version": "0.0.2",
    "author": "Jaya Raj Srivathsav Adari",
    "popularity": 0,
    "isDeprecated": false
  },
  "usage": {
    "recommended": [],
    "codeExample": "import { Slider01TwoTone } from 'magic-icons';\n\n<Slider01TwoTone size={24} color=\"currentColor\" />"
  },
  "accessibility": {
    "ariaLabel": "slider01",
    "title": "Slider01"
  }
}