{
  "id": "arrow-sub-right-down",
  "name": "ArrowSubRightDown",
  "componentBaseName": "ArrowSubRightDown",
  "category": "action",
  "tags": [
    "arrow",
    "sub",
    "right",
    "down"
  ],
  "aliases": [],
  "description": "ArrowSubRightDown icon - Actions & Operations",
  "variants": {
    "outline": {
      "available": true,
      "componentName": "ArrowSubRightDown01",
      "svgPath": "icons/action/arrow-sub-right-down-01.svg",
      "componentPath": "./components/icons/Outline/ArrowSubRightDown01",
      "supportsStrokeWidth": false,
      "defaultStrokeWidth": 0,
      "fillType": "fill"
    },
    "light": {
      "available": true,
      "componentName": "ArrowSubRightDown04",
      "svgPath": "icons/action/arrow-sub-right-down-04.svg",
      "componentPath": "./components/icons/Light/ArrowSubRightDown04",
      "supportsStrokeWidth": true,
      "defaultStrokeWidth": 1,
      "fillType": "stroke"
    }
  },
  "metadata": {
    "addedDate": "2025-11-01",
    "lastModified": "2025-11-01",
    "version": "0.0.2",
    "author": "Jaya Raj Srivathsav Adari",
    "popularity": 0,
    "isDeprecated": false
  },
  "usage": {
    "recommended": [],
    "codeExample": "import { ArrowSubRightDownTwoTone } from 'magic-icons';\n\n<ArrowSubRightDownTwoTone size={24} color=\"currentColor\" />"
  },
  "accessibility": {
    "ariaLabel": "arrow sub right down",
    "title": "ArrowSubRightDown"
  }
}