{
  "id": "profile",
  "name": "Profile",
  "componentBaseName": "Profile",
  "category": "user",
  "tags": [
    "profile"
  ],
  "aliases": [],
  "description": "Profile icon - User & Profile",
  "variants": {
    "outline": {
      "available": true,
      "componentName": "Profile01",
      "svgPath": "icons/user/profile-01.svg",
      "componentPath": "./components/icons/Outline/Profile01",
      "supportsStrokeWidth": false,
      "defaultStrokeWidth": 0,
      "fillType": "fill"
    },
    "broken": {
      "available": true,
      "componentName": "Profile02",
      "svgPath": "icons/user/profile-02.svg",
      "componentPath": "./components/icons/Broken/Profile02",
      "supportsStrokeWidth": false,
      "defaultStrokeWidth": 0,
      "fillType": "fill"
    },
    "bulk": {
      "available": true,
      "componentName": "Profile03",
      "svgPath": "icons/user/profile-03.svg",
      "componentPath": "./components/icons/Bulk/Profile03",
      "supportsStrokeWidth": false,
      "defaultStrokeWidth": 0,
      "fillType": "fill"
    },
    "light": {
      "available": true,
      "componentName": "Profile04",
      "svgPath": "icons/user/profile-04.svg",
      "componentPath": "./components/icons/Light/Profile04",
      "supportsStrokeWidth": true,
      "defaultStrokeWidth": 1,
      "fillType": "stroke"
    },
    "two-tone": {
      "available": true,
      "componentName": "Profile05",
      "svgPath": "icons/user/profile-05.svg",
      "componentPath": "./components/icons/TwoTone/Profile05",
      "supportsStrokeWidth": true,
      "defaultStrokeWidth": 1.5,
      "fillType": "mixed"
    }
  },
  "metadata": {
    "addedDate": "2025-10-31",
    "lastModified": "2025-10-31",
    "version": "0.0.2",
    "author": "Jaya Raj Srivathsav Adari",
    "popularity": 0,
    "isDeprecated": false
  },
  "usage": {
    "recommended": [],
    "codeExample": "import { ProfileTwoTone } from 'magic-icons';\n\n<ProfileTwoTone size={24} color=\"currentColor\" />"
  },
  "accessibility": {
    "ariaLabel": "profile",
    "title": "Profile"
  }
}