{
  "id": "chevron-down-duo",
  "name": "ChevronDownDuo",
  "componentBaseName": "ChevronDownDuo",
  "category": "action",
  "tags": [
    "chevron",
    "down",
    "duo"
  ],
  "aliases": [],
  "description": "ChevronDownDuo icon - Actions & Operations",
  "variants": {
    "outline": {
      "available": true,
      "componentName": "ChevronDownDuoOutline",
      "svgPath": "icons/action/chevron-down-duo-outline.svg",
      "componentPath": "./components/icons/Outline/ChevronDownDuoOutline",
      "supportsStrokeWidth": false,
      "defaultStrokeWidth": 0,
      "fillType": "fill"
    }
  },
  "metadata": {
    "addedDate": "2025-10-31",
    "lastModified": "2025-10-31",
    "version": "0.0.2",
    "author": "Jaya Raj Srivathsav Adari",
    "popularity": 0,
    "isDeprecated": false
  },
  "usage": {
    "recommended": [],
    "codeExample": "import { ChevronDownDuoTwoTone } from 'magic-icons';\n\n<ChevronDownDuoTwoTone size={24} color=\"currentColor\" />"
  },
  "accessibility": {
    "ariaLabel": "chevron down duo",
    "title": "ChevronDownDuo"
  }
}