{
  "id": "heart011",
  "name": "Heart011",
  "componentBaseName": "Heart011",
  "category": "action",
  "tags": [
    "heart011"
  ],
  "aliases": [],
  "description": "Heart011 icon - Actions & Operations",
  "variants": {
    "outline": {
      "available": true,
      "componentName": "Heart01101",
      "svgPath": "icons/action/heart-01-1-01.svg",
      "componentPath": "./components/icons/Outline/Heart01101",
      "supportsStrokeWidth": false,
      "defaultStrokeWidth": 0,
      "fillType": "fill"
    }
  },
  "metadata": {
    "addedDate": "2025-11-01",
    "lastModified": "2025-11-01",
    "version": "0.0.2",
    "author": "Jaya Raj Srivathsav Adari",
    "popularity": 0,
    "isDeprecated": false
  },
  "usage": {
    "recommended": [],
    "codeExample": "import { Heart011TwoTone } from 'magic-icons';\n\n<Heart011TwoTone size={24} color=\"currentColor\" />"
  },
  "accessibility": {
    "ariaLabel": "heart011",
    "title": "Heart011"
  }
}