{
  "id": "filter-off",
  "name": "FilterOff",
  "componentBaseName": "FilterOff",
  "category": "action",
  "tags": [
    "filter",
    "off"
  ],
  "aliases": [],
  "description": "FilterOff icon - Actions & Operations",
  "variants": {
    "outline": {
      "available": true,
      "componentName": "FilterOff01",
      "svgPath": "icons/action/filter-off-01.svg",
      "componentPath": "./components/icons/Outline/FilterOff01",
      "supportsStrokeWidth": false,
      "defaultStrokeWidth": 0,
      "fillType": "fill"
    }
  },
  "metadata": {
    "addedDate": "2025-10-31",
    "lastModified": "2025-10-31",
    "version": "0.0.2",
    "author": "Jaya Raj Srivathsav Adari",
    "popularity": 0,
    "isDeprecated": false
  },
  "usage": {
    "recommended": [],
    "codeExample": "import { FilterOffTwoTone } from 'magic-icons';\n\n<FilterOffTwoTone size={24} color=\"currentColor\" />"
  },
  "accessibility": {
    "ariaLabel": "filter off",
    "title": "FilterOff"
  }
}