{
  "id": "link-horizontal-off",
  "name": "LinkHorizontalOff",
  "componentBaseName": "LinkHorizontalOff",
  "category": "action",
  "tags": [
    "link",
    "horizontal",
    "off"
  ],
  "aliases": [],
  "description": "LinkHorizontalOff icon - Actions & Operations",
  "variants": {
    "outline": {
      "available": true,
      "componentName": "LinkHorizontalOff01",
      "svgPath": "icons/action/link-horizontal-off-01.svg",
      "componentPath": "./components/icons/Outline/LinkHorizontalOff01",
      "supportsStrokeWidth": false,
      "defaultStrokeWidth": 0,
      "fillType": "fill"
    },
    "light": {
      "available": true,
      "componentName": "LinkHorizontalOff04",
      "svgPath": "icons/action/link-horizontal-off-04.svg",
      "componentPath": "./components/icons/Light/LinkHorizontalOff04",
      "supportsStrokeWidth": true,
      "defaultStrokeWidth": 1,
      "fillType": "stroke"
    }
  },
  "metadata": {
    "addedDate": "2025-11-01",
    "lastModified": "2025-11-01",
    "version": "0.0.2",
    "author": "Jaya Raj Srivathsav Adari",
    "popularity": 0,
    "isDeprecated": false
  },
  "usage": {
    "recommended": [],
    "codeExample": "import { LinkHorizontalOffTwoTone } from 'magic-icons';\n\n<LinkHorizontalOffTwoTone size={24} color=\"currentColor\" />"
  },
  "accessibility": {
    "ariaLabel": "link horizontal off",
    "title": "LinkHorizontalOff"
  }
}