{
  "id": "book-open",
  "name": "BookOpen",
  "componentBaseName": "BookOpen",
  "category": "action",
  "tags": [
    "book",
    "open"
  ],
  "aliases": [],
  "description": "BookOpen icon - Actions & Operations",
  "variants": {
    "outline": {
      "available": true,
      "componentName": "BookOpen01",
      "svgPath": "icons/action/book-open-01.svg",
      "componentPath": "./components/icons/Outline/BookOpen01",
      "supportsStrokeWidth": false,
      "defaultStrokeWidth": 0,
      "fillType": "fill"
    },
    "light": {
      "available": true,
      "componentName": "BookOpen04",
      "svgPath": "icons/action/book-open-04.svg",
      "componentPath": "./components/icons/Light/BookOpen04",
      "supportsStrokeWidth": true,
      "defaultStrokeWidth": 1,
      "fillType": "stroke"
    }
  },
  "metadata": {
    "addedDate": "2025-11-01",
    "lastModified": "2025-11-01",
    "version": "0.0.2",
    "author": "Jaya Raj Srivathsav Adari",
    "popularity": 0,
    "isDeprecated": false
  },
  "usage": {
    "recommended": [],
    "codeExample": "import { BookOpenTwoTone } from 'magic-icons';\n\n<BookOpenTwoTone size={24} color=\"currentColor\" />"
  },
  "accessibility": {
    "ariaLabel": "book open",
    "title": "BookOpen"
  }
}