{
  "id": "arrow-up-square",
  "name": "ArrowUpSquare",
  "componentBaseName": "ArrowUpSquare",
  "category": "navigation",
  "tags": [
    "arrow",
    "up",
    "square"
  ],
  "aliases": [],
  "description": "ArrowUpSquare icon - Navigation & Arrows",
  "variants": {
    "outline": {
      "available": true,
      "componentName": "ArrowUpSquare01",
      "svgPath": "icons/navigation/arrow-up-square-01.svg",
      "componentPath": "./components/icons/Outline/ArrowUpSquare01",
      "supportsStrokeWidth": false,
      "defaultStrokeWidth": 0,
      "fillType": "fill"
    },
    "broken": {
      "available": true,
      "componentName": "ArrowUpSquare02",
      "svgPath": "icons/navigation/arrow-up-square-02.svg",
      "componentPath": "./components/icons/Broken/ArrowUpSquare02",
      "supportsStrokeWidth": false,
      "defaultStrokeWidth": 0,
      "fillType": "fill"
    },
    "bulk": {
      "available": true,
      "componentName": "ArrowUpSquare03",
      "svgPath": "icons/navigation/arrow-up-square-03.svg",
      "componentPath": "./components/icons/Bulk/ArrowUpSquare03",
      "supportsStrokeWidth": false,
      "defaultStrokeWidth": 0,
      "fillType": "fill"
    },
    "light": {
      "available": true,
      "componentName": "ArrowUpSquare04",
      "svgPath": "icons/navigation/arrow-up-square-04.svg",
      "componentPath": "./components/icons/Light/ArrowUpSquare04",
      "supportsStrokeWidth": true,
      "defaultStrokeWidth": 1,
      "fillType": "stroke"
    },
    "two-tone": {
      "available": true,
      "componentName": "ArrowUpSquare05",
      "svgPath": "icons/navigation/arrow-up-square-05.svg",
      "componentPath": "./components/icons/TwoTone/ArrowUpSquare05",
      "supportsStrokeWidth": true,
      "defaultStrokeWidth": 1.5,
      "fillType": "mixed"
    }
  },
  "metadata": {
    "addedDate": "2025-11-01",
    "lastModified": "2025-11-01",
    "version": "0.0.2",
    "author": "Jaya Raj Srivathsav Adari",
    "popularity": 0,
    "isDeprecated": false
  },
  "usage": {
    "recommended": [],
    "codeExample": "import { ArrowUpSquareTwoTone } from 'magic-icons';\n\n<ArrowUpSquareTwoTone size={24} color=\"currentColor\" />"
  },
  "accessibility": {
    "ariaLabel": "arrow up square",
    "title": "ArrowUpSquare"
  }
}