{
  "id": "search",
  "name": "Search",
  "componentBaseName": "Search",
  "category": "ui",
  "tags": [
    "search"
  ],
  "aliases": [],
  "description": "Search icon - UI Elements",
  "variants": {
    "broken": {
      "available": true,
      "componentName": "SearchBroken",
      "svgPath": "icons/ui/Search-broken.svg",
      "componentPath": "./components/icons/Broken/SearchBroken",
      "supportsStrokeWidth": false,
      "defaultStrokeWidth": 0,
      "fillType": "fill"
    },
    "bulk": {
      "available": true,
      "componentName": "SearchBulk",
      "svgPath": "icons/ui/Search-bulk.svg",
      "componentPath": "./components/icons/Bulk/SearchBulk",
      "supportsStrokeWidth": false,
      "defaultStrokeWidth": 0,
      "fillType": "fill"
    },
    "light": {
      "available": true,
      "componentName": "SearchLight",
      "svgPath": "icons/ui/Search-light.svg",
      "componentPath": "./components/icons/Light/SearchLight",
      "supportsStrokeWidth": true,
      "defaultStrokeWidth": 1,
      "fillType": "stroke"
    },
    "outline": {
      "available": true,
      "componentName": "SearchOutline",
      "svgPath": "icons/ui/Search-outline.svg",
      "componentPath": "./components/icons/Outline/SearchOutline",
      "supportsStrokeWidth": false,
      "defaultStrokeWidth": 0,
      "fillType": "fill"
    },
    "two-tone": {
      "available": true,
      "componentName": "SearchTwoTone",
      "svgPath": "icons/ui/Search-two-tone.svg",
      "componentPath": "./components/icons/TwoTone/SearchTwoTone",
      "supportsStrokeWidth": true,
      "defaultStrokeWidth": 1.5,
      "fillType": "mixed"
    }
  },
  "metadata": {
    "addedDate": "2025-10-31",
    "lastModified": "2025-10-31",
    "version": "0.0.2",
    "author": "Jaya Raj Srivathsav Adari",
    "popularity": 0,
    "isDeprecated": false
  },
  "usage": {
    "recommended": [],
    "codeExample": "import { SearchTwoTone } from 'magic-icons';\n\n<SearchTwoTone size={24} color=\"currentColor\" />"
  },
  "accessibility": {
    "ariaLabel": "search",
    "title": "Search"
  }
}